{
  "contract": "C1",
  "version": "0",
  "user_id": "eval-user",
  "device_id": "mac-eval-1",
  "stream_id": "stream-EVAL",
  "sequence": 6,
  "chunk_id": "chunk-smoke-0006",
  "modality": "video",
  "codec": "video/mp4",
  "t_start": "2026-07-25T09:01:00Z",
  "t_end": "2026-07-25T09:01:10Z",
  "blob_ref": "raw/eval-user/chunk-smoke-0006.mp4",
  "blob_sha256": "e3b0c44298fc1c149afbf4c8996fb92427ae41e4649b934ca495991b7852b855",
  "blob_bytes": 0
}
