{
  "contract": "C1",
  "version": "0",
  "user_id": "pilot-user",
  "device_id": "bodycam-1",
  "stream_id": "stream-video-CCCC",
  "sequence": 0,
  "chunk_id": "chunk-video-0001",
  "modality": "video",
  "codec": "video/mp4",
  "t_start": "2026-07-10T09:02:00Z",
  "t_end": "2026-07-10T09:02:20Z",
  "blob_ref": "raw/pilot-user/chunk-video-0001.mp4",
  "blob_sha256": "e686afe5aa7abb8c9c0035a15d514b5f9dd6de8f730006bf9bff866d796dac0b",
  "blob_bytes": 47
}
